{
  "name": "ActOneDesigner",
  "publisher": "Actimize",
  "version": "6.3.0.2",
  "install": { "commandLine": "Invoke-AppDeployToolkit.exe -DeploymentType Install -DeployMode Silent" },
  "uninstall": { "commandLine": "Invoke-AppDeployToolkit.exe -DeploymentType Uninstall -DeployMode Silent" },
  "detection": {
    "type": "file",
    "path": "Z:\\Actimize_ActOneDesigner_6.3.0.2\\Files",
    "fileOrFolder": "ContosoTool.exe",
    "operator": "versionGreaterThanOrEqual",
    "version": "5.0.0"
  }
}