{
  "name": "Acme App",
  "publisher": "Acme",
  "version": "1.2.3",
  "install": { "commandLine": "Invoke-AppDeployToolkit.exe -DeploymentType Install -DeployMode Silent" },
  "uninstall": { "commandLine": "Invoke-AppDeployToolkit.exe -DeploymentType Uninstall -DeployMode Silent" },
  "detection": {
    "type": "registry",
    "hive": "HKLM",
    "keyPath": "SOFTWARE\\Acme\\AcmeApp",
    "valueName": "Version",
    "operator": "greaterThanOrEqual",
    "value": "1.2.3"
  }
}